{
  "artifact_type": "candidate_list",
  "as_of_date": "2025-09-18",
  "candidates": [
    {
      "candidate_id": "cand_aapl_562b3b7167aba14f",
      "classification_status": "ok",
      "packet_id": "pkt_aapl_20250918_d8c38d66e739f0e1",
      "symbol": "AAPL"
    }
  ],
  "config_fingerprint": "7da318e9bf2a3f80782b3370fe5246eff1be663b92e098a6cfdb97b904eb55c7",
  "environment": "local",
  "generated_at": "2026-04-20T22:01:19.760585Z",
  "run_id": "run_local_20250918_3e3337a6d2837850",
  "schema_version": "v1.0.0",
  "setup_family": "trend_pullback"
}