{
  "artifact_type": "candidate_list",
  "as_of_date": "2025-09-18",
  "candidates": [
    {
      "candidate_id": "cand_splt_d856738eb87186cf",
      "classification_status": "ok",
      "packet_id": "pkt_splt_20250918_61239626aa15c622",
      "symbol": "SPLT"
    },
    {
      "candidate_id": "cand_stal_258050660731824a",
      "classification_status": "ok",
      "packet_id": "pkt_stal_20250918_7dae26353a71fda8",
      "symbol": "STAL"
    },
    {
      "candidate_id": "cand_trnd_1828e9c37fdef7ff",
      "classification_status": "ok",
      "packet_id": "pkt_trnd_20250918_02f95006ab180059",
      "symbol": "TRND"
    }
  ],
  "config_fingerprint": "7da318e9bf2a3f80782b3370fe5246eff1be663b92e098a6cfdb97b904eb55c7",
  "environment": "local",
  "generated_at": "2025-09-18T21:15:00Z",
  "run_id": "run_local_20250918_3e3337a6d2837850",
  "schema_version": "v1.0.0",
  "setup_family": "trend_pullback"
}