{
  "artifact_type": "candidate_list",
  "as_of_date": "2025-09-18",
  "candidates": [
    {
      "candidate_id": "cand_base_7502bd352b6cf463",
      "classification_status": "ok",
      "packet_id": "pkt_base_20250918_c5e29def4b368fa2",
      "symbol": "BASE"
    },
    {
      "candidate_id": "cand_cnfl_80412ecaeffaaa81",
      "classification_status": "ok",
      "packet_id": "pkt_cnfl_20250918_1affa3696e4c4b8f",
      "symbol": "CNFL"
    }
  ],
  "config_fingerprint": "7da318e9bf2a3f80782b3370fe5246eff1be663b92e098a6cfdb97b904eb55c7",
  "environment": "local",
  "generated_at": "2025-09-18T21:15:00Z",
  "run_id": "run_local_20250918_3e3337a6d2837850",
  "schema_version": "v1.0.0",
  "setup_family": "base_breakout"
}